Urls,Body
http://asokatechnologies.in/bl-csc-converter-fed-bldc-motor-drive-power-factor-correction/,"IEEE TRANSACTIONS ON INDUSTRIAL ELECTRONICS, 2013 ABSTRACT: This paper presents a power factor correction (PFC) based bridgeless-canonical switching cell (BL-CSC) converter fed brushless DC (BLDC) motor drive. The proposed BL-CSC converter operating in a discontinuous inductor current mode is used to achieve a unity power factor at the AC mains using a single voltage sensor. The speed of BLDC motor is controlled by varying the DC bus voltage of the voltage source inverter (VSI) feeding BLDC motor via a PFC converter. Therefore, the BLDC motor is electronically commutated such that the VSI operates in fundamental frequency switching for reduced switching losses. Moreover, the bridgeless configuration of CSC converter offers low conduction losses due to partial elimination of diode bridge rectifier at the front end. The proposed configuration shows a considerable increase in efficiency as compared to the conventional scheme. The performance of the proposed drive is validated through experimental results obtained on a developed prototype. Improved power quality is achieved at the AC mains for a wide range of control speeds and supply voltages. The obtained power quality indices are within the acceptable limits of IEC 61000-3-2 KEYWORDS:  BLDC Motor BL-CSC Converter DICM PFC Power Quality  SOFTWARE: MATLAB/SIMULINK CIRCUIT DIAGRAM:   Fig. 1. Proposed BL-CSC converter fed BLDC motor drive EXPECTED SIMULATION RESULTS:   Fig. 2. Performance of the proposed drive at rated condition with supply voltage as 220V and DC link voltage as (a) 310V and (b) 70V.  Fig. 3. Waveforms of (a) inductor’s currents and (b) intermediate capacitor voltage with supply voltage at rated load on BLDC motor with DC link voltage as 310V and supply voltage as 220V.  Fig. 4. Stress on PFC converter switches and its enlarged waveforms during its operation at rated conditions.  Fig. 5. Recorded dynamic performance of the proposed drive at rated load on BLDC motor during (a) starting at Vdc=50V, (b) speed control during change in DC link voltage from 100V to 170V and (c) sudden change in supply voltage from 250V to 180V. CONCLUSION: A PFC based BL-CSC converter fed BLDC motor drive has been proposed with improved power quality at the AC mains. A bridgeless configuration of a CSC converter has been used for achieving reduced conduction losses in PFC converter. The speed control of BLDC motor and power factor correction at AC mains has been achieved using a single voltage sensor. The switching losses in the VSI have been reduced by the use of fundamental frequency switching by electronically commutating the BLDC motor. Moreover, the speed of BLDC motor has been controlled by controlling the DC link voltage of the VSI. The proposed drive has shown an improved power quality at the AC mains for a wide range of speed control and supply voltages. The obtained power quality indices have been found within the acceptable limits of IEC 61000-3-2. A satisfactory performance of the proposed drive has been obtained and it is a recommended solution for low power applications. REFERENCES: [1] B. Singh and S. Singh, “Single-phase power factor controller topologies for permanent magnet brushless DC motor drives,” IET Power Elect., vol.3, no.2, pp.147-175, March 2010. [2] Chang Liang Xia, Permanent Magnet Brushless DC Motor Drives and Controls, Wiley Press, Beijing, 2012. [3] P. Pillay and R. Krishnan, “Modeling of permanent magnet motor drives,” IEEE Trans. Ind. Elect., vol.35, no.4, pp.537-541, Nov 1988. [4] M. A. Rahman and P. Zhou, “Analysis of brushless permanent magnet synchronous motors,” IEEE Trans. Ind. Elect., vol.43, no.2, pp.256-267, Apr 1996. [5] J. Moreno, M. E. Ortuzar and J.W. Dixon, “Energy-management system for a hybrid electric vehicle, using ultra capacitors and neural networks,” IEEE Trans. Ind. Elect., vol.53, no.2, pp. 614- 623, April 2006."
http://asokatechnologies.in/smib-system-using-ann-based-dpfc/,"International conference on Signal Processing, Communication, Power and Embedded System (SCOPES)-2016, IEEE ABSTRACT: Since last decade, due to advancement in technology and increasing in the electrical loads and also due to complexity of the devices the quality of power distribution is decreases. A Power quality issue is nothing but distortions in current, voltage and frequency that affect the end user equipment or disoperation; these are main problems of power quality so compensation for these problems by DPFC is presented in this paper. The control circuits for DPFC are designed by using line currents, series reference voltages and these are controlled by conventional ANN controllers. The results are observed by MATLAB/SIMULINK model.  KEYWORDS:  Power Quality Voltage Sag DPFC Voltage Swell   SOFTWARE: MATLAB/SIMULINK BLOCK DIAGRAM:  Figure 1: Schematic Diagram for DPFC EXPECTED SIMULATION RESULTS:  Figure 2: Output Voltage during fault condition  Figure 3: Output Current during Fault Condition  Figure 4: Output voltage compensated by DPFC Controller  Figure 5: Compensated Output Current by DPFC Controller  Figure 6: Active and Reactive Power  Figure 7: THD value of system output voltage without DPFC  Figure 8: THD value of DPFC (pi controller) load Voltage  Figure 9: THD for output voltage under ANN Controller  CONCLUSION: In this paper we implemented a concept to controlling the power quality issues i.e. DPFC. The proposed theory of this device is mathematical formulation and analysis of voltage dips and their mitigations for a three phase source with linear load. In this paper we also proposed a concept of Ann controller for better controlling action. As compared to all other facts devices the DPFC based ANN has effectively control all power quality problems and with this technique we get the THD as 3.65% and finally the simulation results are shown above.  REFERENCES:  Ahmad Jamshidi, S.Masoud Barakati, and M.Moradi Ghahderijani presented a paper on “Impact of Distributed Power Flow Controller to Improve Power Quality Based on Synchronous Reference Frame Method” at IACSIT International Journal of Engineering and Technology, Vol. 4, No. 5, October 2012. Ahmad Jamshidi, S.Masoud Barakati, and Mohammad Moradi Ghahderijani posted a paper “Power Quality Improvement and Mitigation Case Study Using Distributed Power Flow Controller” on 978-1-4673-0158-9/12/$31.00 ©2012 IEEE. Srinivasarao, Budi, G. Sreenivasan, and Swathi Sharma. “Comparison of Facts Controller for Power Quality Problems in Power System”, Indian Journal of Science and Technology, 2015. J.R.Enslin, “Power mitigation problems,” in Proc. IEEE Int. Symp. Industrial Electronics (ISIE ’98), vol. 1, 1998, pp. 8– 20. Srinivasarao, Budi, G. Sreenivasan, and Swathi Sharma. “Mitigation of voltage sag for power quality improvement using DPFC system”, 2015 International Conference on Electrical Electronics Signals Communication and Optimization (EESCO), 2015."
http://asokatechnologies.in/bldc-motor-drive-landsman-converter/,"IET Power Electronics, 2016  ABSTRACT: This study presents a novel configuration of power factor regulation (PFR)-based Landsman converter feeding a brushless DC motor (BLDCM) drive for low-power (400 W) white goods applications. The speed control of the drive is achieved through adjusting the DC bus voltage of voltage source inverter (VSI) feeding to a BLDCM. Moreover, low frequency switching signals are used for electronic commutation of BLDCM, which reduces the switching power losses of six solid-state switches of VSI. This Landsman converter-based front-end power factor corrector operating in discontinuous inductor current mode is used to control DC bus voltage and PFR is achieved inherently. The DC bus voltage of the drive is controlled by using a single DC voltage sensor. For evaluating the performance of proposed drive, a prototype is developed in the laboratory. The performance of the BLDCM is also analysed for its operation at varying AC mains voltage (90–265 V). Experiential results for power quality indices are found within the limits of power quality standard IEC 61000-3-2.  SOFTWARE: MATLAB/SIMULINK CIRCUIT DIAGRAM:  Fig. 1Circuit configurations of a PFR based Proposed drive scheme of a Landsman converter fed PMBLDCM drive EXPECTED SIMULATION RESULTS:   Fig. 2 Performance of proposed drive at rated torque on motor a Steady-state performance of the proposed BLDCM drive at rated load on BLDCM with DC-link voltage as 200 V and supply voltage as 220 V b–d Obtained power quality indices  Fig. 3 Performance of proposed drive at rated load on motor a Steady-state performance of the proposed BLDCM drive at rated load on BLDCM with DC-link voltage as 60 V and supply voltage as 220 V b–d Obtained power quality indices  Fig. 4 Performance of PFR-based Landsman converter a Input and output inductor’s currents and intermediate capacitor’s waveforms b Current and voltage stress on a PFR switch at rated load on BLDCM at rated condition  Fig. 5 Dynamic performances of the proposed BLDCM drive system during a Starting at 60 V b Speed control for variation in DC bus voltage from 100 to 150 V c Load variation d Supply voltage change from 260 to 210 V CONCLUSION: A PFR-based Landsman converter fed BLDCM drive has been proposed for the use in low power household appliances. Adjustable voltage control of DC bus of VSI has been used to control the speed of BLDCM which eventually has given the freedom to operate the VSI in low frequency switching operation for minimum switching losses. A front-end Landsman converter-based PFR operating in DICM has been applied for double objectives of DC bus voltage control and achieving a UPF at AC supply. Resulted performance for presented drive has been found quite satisfactory for its operation at variation of speed over a wide range. A prototype of Landsman-based BLDCM drive has been implemented with acceptable test results for its operation over complete speed range and its operation over universal AC mains. The stress of the PFR converter switch has been evaluated to conclude its feasibility. The obtained power quality parameters are found within the limit of various international standards like as IEC 61000-3-2. REFERENCES: 1 Gieras, J.F., Wing, M.: ‘Permanent magnet motor technology-design and application’ (Marcel Dekker Inc., New York, 2011) 2 Xia, C.L.: ‘Permanent magnet brushless DC motor drives and controls’ (Wiley Press, Beijing, 2012) 3 Zhu, Z.Q., Howe, D.: ‘Electrical machines and drives for electric, hybrid, and fuel cell vehicles’, IEEE Proc., 2007, 95, (4), pp. 746–765 4 Sozer, Y., Torrey, D.A., Mese, E.: ‘Adaptive predictive current control technique for permanent magnet synchronous motors’, IET Power Electron., 2013, 6, pp. 9–19 5 Hung, C.W., Lin, C.T., Liu, C.W., et al.: ‘A variable-sampling controller for brushless DC motor drives with low-resolution position sensors’, IEEE Trans.Ind. Electron., 2007, 54, (5), pp. 2846–2852"
http://asokatechnologies.in/pwam-controlled-quasi-z-source-motor-drive-2/,"ABSTRACT: This paper proposes a novel pulse-width-amplitude modulation (PWAM) method for three-phase quasi-Z source inverter system in motor drive application. It is demonstrated that it operates at only 1/3 switching frequency of traditional PWM methods, with less harmonic distortion. As a result, switching actions and losses are also reduced significantly. With the proposed modulation, the required capacitance is reduced greatly, which makes a system of smaller volume and lighter weight. Compared to traditional PWM methods, the higher efficiency and better reliability are confirmed in PWAM controlled motor drive system. The motor drive with the proposed hybrid PWAM modulation method presents good performance in simulation. Theoretical analysis is provided to verify the inverter efficiency and design improvements. KEYWORDS:  Quasi-Z-source inverter Pulse-width-amplitude modulation Motor drive   SOFTWARE: MATLAB/SIMULINK CIRCUIT DIAGRAM:  Fig. 1. Quasi-Z source inverter based motor drive [8].  Fig. 2. Topology in the second sector. EXPECTED SIMULATION RESULTS:   Fig. 3. Outcomes of rotation speed r, current ia and torque Tm of motor (f=30 Hz).  Fig. 4. Simulation results of three-phase qZSI when using PWAM method. (a) qZS capacitor voltages vc1and vc2; (b) qZS inductor currents iL1 and iL2; (c) qZSI’s dc-link voltage vpn; (d) qZSI’s output line to line voltage vab(f=30 Hz).  Fig. 5. Simulation results of three-phase qZSI when using PWAM method. (a) qZS capacitor voltages vc1and vc2 ; (b) qZS inductor currents iL1 and iL2; (c) qZSI’s dc-link voltage vpn; (d) qZSI’s output line to line voltage vab(f=50 Hz).  Fig. 6. Outcomes of rotation speed r, current ia and torque Tm of motor (f=50 Hz). CONCLUSION: In this paper, a novel modulation method for three-phase qZSI motor drive was introduced. The qZSI allows dc-link 6ɷ voltage ripples, as a result that the required qZS inductance and capacitance are reduced significantly. Besides, compared to traditional SPWM, only one third of the switches are doing switching actions, which reduced the number of switching time and loss significantly. By using the proposed PWAM modulation method, the motor drive operates well and efficiently.  REFERENCES: [1] H. W. van der Broeck, H. C. Skudelny, G. V. Stanke, “Analysis and Realization of a Pulsewidth Modulator Based on Voltage Space Vectors,” IEEE Transactions on Industry Applications, 1988, pp. 142- 150. [2] H. Abu-Rub, M. Malinowski, K. Al-Haddad: Power Electronics for Renewable Energy Systems, Transportation and Industrial Applications, Hoboken, NJ: John Wiley & Sons Ltd., 2014. [3] C. Y. Leong, N. P. van der Duijn Schouten, P. D. Malliband, R. A. McMahon, “A Comparison of Power Losses for Small Induction Motor Drives Adopting Squarewave and Sinusoidal PWM Excitation,” Second International Conference on Power Electronics, Machines and Drives (PEDG), 2004, pp. 286-290. [4] H. Zhang, B. Ge, Y. Liu, D. Sun, “A Hybrid Modulation Method for Single-Phase Quasi-Z Source Inverter,” in 2014 IEEE Energy Conversion Congress and Exposition (ECCE), pp.4444-4449, 2014. [5] D. Sun, B. Ge, X. Yan, D. Bi, H. Zhang, Y. Liu, H. Abu-Rub, L. BenBrahim, F.Z. Peng, “Modeling, impedance design, and efficiency analysis of quasi-Z source module in cascaded multilevel photovoltaic power system,” IEEE Transactions on Industrial Electronics, vol.61, no.11, pp.6108-6117, Nov. 2014."
